Ref#,Property Name,State,County,City,Street & Number,Area of Significance,Category of Property,Other Names,Property ID,Address
100007212,Lawyers Cooperative Publishing Company Complex,NEW YORK,Monroe,Rochester,"52 and 28-50 Aqueduct, 40-50 East Broad, 38-46 Graves, and 11 Race Sts.",ARCHITECTURE; INDUSTRY,building,Aqueduct Building,100007212,"52 and 28-50 Aqueduct, 40-50 East Broad, 38-46 Graves, and 11 Race Sts., Rochester, NEW YORK"
85002860,Little Theatre,NEW YORK,Monroe,Rochester,240 East Ave.,ENTERTAINMENT/RECREATION; ARCHITECTURE,BUILDING,NA,85002860,"240 East Ave., Rochester, NEW YORK"
83004059,Apollo Theater,NEW YORK,New York,New York,253 W. 125th St.,ARCHITECTURE; PERFORMING ARTS,BUILDING,NA,83004059,"253 W. 125th St., New York, NEW YORK"
82001187,Beacon Theater and Hotel,NEW YORK,New York,New York,2124 Broadway,ENTERTAINMENT/RECREATION; ARCHITECTURE,BUILDING,NA,82001187,"2124 Broadway, New York, NEW YORK"
04001203,Biltmore Theater,NEW YORK,New York,New York,261-265 W. 47th St.,ARCHITECTURE; PERFORMING ARTS,BUILDING,NA,04001203,"261-265 W. 47th St., New York, NEW YORK"
80002671,Bouwerie Lane Theater,NEW YORK,New York,New York,330 Bowery St.,ARCHITECTURE,BUILDING,Bond Street Bank;German Exchange Bank,80002671,"330 Bowery St., New York, NEW YORK"
74001272,Henry Street Settlement and Neighborhood Playhouse,NEW YORK,New York,New York,263-267 Henry St. and 466 Grand St.,SOCIAL HISTORY,BUILDING,NA,74001272,"263-267 Henry St. and 466 Grand St., New York, NEW YORK"
16000780,Hudson Theatre,NEW YORK,New York,New York,139-141 W. 44th St.,ARCHITECTURE; ENTERTAINMENT/RECREATION,building,NA,16000780,"139-141 W. 44th St., New York, NEW YORK"
85002427,Louis N. Jaffe Art Theater Building (Additional Documentation),NEW YORK,New York,New York,189 Second Ave.,ARCHITECTURE; PERFORMING ARTS; SOCIAL HISTORY; ART,building,Yiddish Art Theatre; Yiddish Folks Theater; [Ludwig] Satz Folks Theater; Molly Picon’s Folks Theater; [Misha and Lucy] Germans’ Folks Theater; New York Art Troupe at the Yiddish Folks Theater; New Jewish Folk Theater; and more,85002427,"189 Second Ave., New York, NEW YORK"
85002423,Minton's Playhouse,NEW YORK,New York,New York,206--210 W. One Hundred Eighteenth St.,PERFORMING ARTS,BUILDING,NA,85002423,"206--210 W. One Hundred Eighteenth St., New York, NEW YORK"
80002664,New Amsterdam Theater,NEW YORK,New York,New York,214 W. 42nd St.,ART; ENGINEERING; ENTERTAINMENT/RECREATION; ARCHITECTURE,BUILDING,"The New Amsterdam Theater,Rooftop Theater &amp; Aerial Gardens;T",80002664,"214 W. 42nd St., New York, NEW YORK"
70000424,New York Shakespeare Festival Public Theater,NEW YORK,New York,New York,425 Lafayette St.,ARCHITECTURE,BUILDING,Astor Library,70000424,"425 Lafayette St., New York, NEW YORK"
97001303,"Sullivan, Ed, Theater",NEW YORK,New York,New York,1697--1699 Broadway,ARCHITECTURE; ENTERTAINMENT/RECREATION,BUILDING,Hammerstein's Theater,97001303,"1697--1699 Broadway, New York, NEW YORK"
85002427,Yiddish Art Theatre,NEW YORK,New York,New York,189 Second Ave.,ARCHITECTURE; PERFORMING ARTS,BUILDING,NA,85002427,"189 Second Ave., New York, NEW YORK"
80002731,Riviera Theatre,NEW YORK,Niagara,North Tonawanda,27 Webster St.,ART; ARCHITECTURE; PERFORMING ARTS,BUILDING,NA,80002731,"27 Webster St., North Tonawanda, NEW YORK"
76001255,Stanley Theater,NEW YORK,Oneida,Utica,259 Genesee St.,ARCHITECTURE; PERFORMING ARTS,BUILDING,NA,76001255,"259 Genesee St., Utica, NEW YORK"
100005466,Uptown Theatre,NEW YORK,Oneida,Utica,2014 Genesee St.,ARCHITECTURE; ENTERTAINMENT/RECREATION,building,NA,100005466,"2014 Genesee St., Utica, NEW YORK"
77000970,Loew's State Theater,NEW YORK,Onondaga,Syracuse,362--374 S. Salina St.,ENTERTAINMENT/RECREATION; ARCHITECTURE,BUILDING,Loew's Theater,77000970,"362--374 S. Salina St., Syracuse, NEW YORK"
02001454,Smith's Opera House,NEW YORK,Ontario,Geneva,82 Seneca St.,NA,BUILDING,NA,02001454,"82 Seneca St., Geneva, NEW YORK"
02000136,Paramount Theatre,NEW YORK,Orange,Middletown,South St.,ARCHITECTURE; ENTERTAINMENT/RECREATION,BUILDING,NA,02000136,"South St., Middletown, NEW YORK"
88001590,Oswego Theater,NEW YORK,Oswego,Oswego,138 W. Second St.,ARCHITECTURE,BUILDING,NA,88001590,"138 W. Second St., Oswego, NEW YORK"
02000555,Oneonta Theatre,NEW YORK,Otsego,Oneonta,47 Chestnut St.,ARCHITECTURE; ENTERTAINMENT/RECREATION,BUILDING,NA,02000555,"47 Chestnut St., Oneonta, NEW YORK"
82001260,RKO Keith's Theater,NEW YORK,Queens,New York,129-143 Northern Blvd.,COMMERCE; ENTERTAINMENT/RECREATION; ARCHITECTURE,BUILDING,NA,82001260,"129-143 Northern Blvd., New York, NEW YORK"
79001623,Proctor's Theater,NEW YORK,Rensselaer,Troy,82 4th St.,ARCHITECTURE; COMMUNICATIONS; PERFORMING ARTS,BUILDING,NA,79001623,"82 4th St., Troy, NEW YORK"
83001788,Tappan Zee Playhouse,NEW YORK,Rockland,Nyack,20 S. Broadway,ARCHITECTURE; PERFORMING ARTS,BUILDING,Broadway Theater,83001788,"20 S. Broadway, Nyack, NEW YORK"
79003237,"Proctor, F. F., Theatre and Arcade",NEW YORK,Schenectady,Schenectady,432 State St.,ARCHITECTURE; COMMUNICATIONS; PERFORMING ARTS,BUILDING,NA,79003237,"432 State St., Schenectady, NEW YORK"
13000373,Cherry Grove Community House and Theatre,NEW YORK,Suffolk,Cherry Grove,180 Bayview Walk,SOCIAL HISTORY; PERFORMING ARTS; COMMUNITY PLANNING AND DEVELOPMENT,BUILDING,The Cherry Grove Playhouse; The Cherry Grove Theater,13000373,"180 Bayview Walk, Cherry Grove, NEW YORK"
88000052,Montauk Tennis Auditorium,NEW YORK,Suffolk,Montauk,Flamingon Ave. and Edjemere St.,ENTERTAINMENT/RECREATION; ARCHITECTURE,BUILDING,Montauk Playhouse,88000052,"Flamingon Ave. and Edjemere St., Montauk, NEW YORK"
01000170,Center Theatre,NEW YORK,Sullivan,Woodbourne,NY 52,ENTERTAINMENT/RECREATION; ARCHITECTURE,BUILDING,Woodbourne Theater,01000170,"NY 52, Woodbourne, NEW YORK"
01000043,Rialto Theatre,NEW YORK,Sullivan,Monticello,Broadway,ENTERTAINMENT/RECREATION; ARCHITECTURE,BUILDING,Miller and Washington Block,01000043,"Broadway, Monticello, NEW YORK"
00001691,Rivoli Theatre,NEW YORK,Sullivan,South Fallsburg,Jct. of NY 42 and Laurel Ave.,ENTERTAINMENT/RECREATION; ARCHITECTURE,BUILDING,NA,00001691,"Jct. of NY 42 and Laurel Ave., South Fallsburg, NEW YORK"
04000284,Shelburne Playhouse,NEW YORK,Sullivan,Ferndale,Upper Ferndale Rd.,ENTERTAINMENT/RECREATION; ARCHITECTURE,BUILDING,NA,04000284,"Upper Ferndale Rd., Ferndale, NEW YORK"
96000613,State Theater,NEW YORK,Tompkins,Ithaca,107--119 W. State St.,ENTERTAINMENT/RECREATION; ARCHITECTURE,BUILDING,NA,96000613,"107--119 W. State St., Ithaca, NEW YORK"
79001639,Community Theatre,NEW YORK,Ulster,Kingston,601 Broadway,ARCHITECTURE; PERFORMING ARTS,BUILDING,Broadway Theatre,79001639,"601 Broadway, Kingston, NEW YORK"
02000799,Marcella Sembrich Opera Museum,NEW YORK,Warren,Bolton Landing,4800 Lake Shore Dr.,PERFORMING ARTS; ENTERTAINMENT/RECREATION; ARCHITECTURE; EDUCATION,BUILDING,Marcella Sembrich Memorial Studio,02000799,"4800 Lake Shore Dr., Bolton Landing, NEW YORK"
84003426,Capitol Theater,NEW YORK,Westchester,Port Chester,147-151 Westchester Ave.,ARCHITECTURE,BUILDING,NA,84003426,"147-151 Westchester Ave., Port Chester, NEW YORK"
08001083,Proctor's Theater,NEW YORK,Westchester,Yonkers,53 S. Broadway,ARCHITECTURE; ENTERTAINMENT/RECREATION,BUILDING,Proctor's Palace; RKO Proctor's Theater,08001083,"53 S. Broadway, Yonkers, NEW YORK"
08001035,Sampson Theatre,NEW YORK,Yates,Penn Yan,130-136 E. Elm St.,ARCHITECTURE; ENTERTAINMENT/RECREATION,BUILDING,NA,08001035,"130-136 E. Elm St., Penn Yan, NEW YORK"
100004322,Gem Theatre,NORTH CAROLINA,Cabarrus,Kannapolis,111 West 1st Street,ARCHITECTURE; ENTERTAINMENT/RECREATION,building,NA,100004322,"111 West 1st Street, Kannapolis, NORTH CAROLINA"
72000946,Masonic Temple and Theater,NORTH CAROLINA,Craven,New Bern,516 Hancock St.,ART; ENTERTAINMENT/RECREATION; ARCHITECTURE,BUILDING,"St. John's Lodge No. 3,A.F. &amp; A.M.",72000946,"516 Hancock St., New Bern, NORTH CAROLINA"
83001847,Carolina Theater,NORTH CAROLINA,Cumberland,Fayetteville,443 Hay St.,ARCHITECTURE,BUILDING,NA,83001847,"443 Hay St., Fayetteville, NORTH CAROLINA"
90002139,"Reynolds, Richard J., High School and Richard J. Reynolds Memorial Auditorium",NORTH CAROLINA,Forsyth,Winston-Salem,301 Hawthorne Rd.,EDUCATION; ARCHITECTURE,BUILDING,Reynolds High School and Reynolds Auditorium,90002139,"301 Hawthorne Rd., Winston-Salem, NORTH CAROLINA"
00000226,Colonial Theater,NORTH CAROLINA,Haywood,Canton,55-57 Park St.,ENTERTAINMENT/RECREATION; ARCHITECTURE,BUILDING,NA,00000226,"55-57 Park St., Canton, NORTH CAROLINA"
85001657,"Brown, C. S., School Auditorium",NORTH CAROLINA,Hertford,Winton,Off NC 45,EDUCATION; ARCHITECTURE,DISTRICT,Brown Hall,85001657,"Off NC 45, Winton, NORTH CAROLINA"
01001133,Clayton Graded School and Clayton Grammar School-Municipal Auditorium,NORTH CAROLINA,Johnston,Clayton,101 and 111 2nd St.,ARCHITECTURE; EDUCATION,BUILDING,Clayton Elementary School,01001133,"101 and 111 2nd St., Clayton, NORTH CAROLINA"
83001895,Temple Theatre,NORTH CAROLINA,Lee,Sanford,120 Carthage St.,OTHER; ARCHITECTURE,BUILDING,NA,83001895,"120 Carthage St., Sanford, NORTH CAROLINA"
100010678,Tobacco Growers Cooperative Association Warehouse,NORTH CAROLINA,Nash,Nashville,723 Barnes Street,AGRICULTURE,building,Nashville Building Supply,100010678,"723 Barnes Street, Nashville, NORTH CAROLINA"
71000605,Playmakers Theatre,NORTH CAROLINA,Orange,Chapel Hill,"Cameron Ave., University of North Carolina campus",ARCHITECTURE; PERFORMING ARTS,BUILDING,Smith Hall,71000605,"Cameron Ave., University of North Carolina campus, Chapel Hill, NORTH CAROLINA"
11000210,Sunset Theater,NORTH CAROLINA,Randolph,Asheboro,"232, 234, 236 Sunset Ave",ARCHITECTURE,BUILDING,NA,11000210,"232, 234, 236 Sunset Ave, Asheboro, NORTH CAROLINA"
81000426,Carolina Theatre,NORTH CAROLINA,Robeson,Lumberton,319 N. Chestnut St.,ENTERTAINMENT/RECREATION; ARCHITECTURE; SOCIAL HISTORY,BUILDING,NA,81000426,"319 N. Chestnut St., Lumberton, NORTH CAROLINA"
95000180,Opera House-Starnes Jewelers Building,NORTH CAROLINA,Stanly,Albemarle,127--133 W. Main St.,ARCHITECTURE; COMMERCE; ENTERTAINMENT/RECREATION,BUILDING,NA,95000180,"127--133 W. Main St., Albemarle, NORTH CAROLINA"
10001195,Amphitheater and Fieldstone WPA Features at Valley City Pioneer Park,NORTH DAKOTA,Barnes,Valley City,SW of the intersection between 5th St and 8th Ave NW,ARCHITECTURE; LANDSCAPE ARCHITECTURE; CONSERVATION,OBJECT,Barnes County Pioneers Memorial Park Open-Air Theater,10001195,"SW of the intersection between 5th St and 8th Ave NW, Valley City, NORTH DAKOTA"
07001341,Valley City Municipal Auditorium,NORTH DAKOTA,Barnes,Valley City,320 Central Ave. S.,ENTERTAINMENT/RECREATION; SOCIAL HISTORY; ARCHITECTURE,BUILDING,City Auditorium,07001341,"320 Central Ave. S., Valley City, NORTH DAKOTA"
76001351,Bismarck Civic Auditorium,NORTH DAKOTA,Burleigh,Bismarck,201 N. 6th St.,ARCHITECTURE; PERFORMING ARTS,BUILDING,City Auditorium,76001351,"201 N. 6th St., Bismarck, NORTH DAKOTA"
82001312,Fargo Theatre Building,NORTH DAKOTA,Cass,Fargo,314 Broadway,ENTERTAINMENT/RECREATION; ARCHITECTURE,BUILDING,NA,82001312,"314 Broadway, Fargo, NORTH DAKOTA"
98001341,Roxy Theatre,NORTH DAKOTA,Cavalier,Langdon,714 Third St.,ARCHITECTURE; SOCIAL HISTORY,BUILDING,32CV527,98001341,"714 Third St., Langdon, NORTH DAKOTA"
92000354,Ellendale Opera House Block,NORTH DAKOTA,Dickey,Ellendale,105--111 Main St.,ENTERTAINMENT/RECREATION; ARCHITECTURE,BUILDING,Ellendale Opera House,92000354,"105--111 Main St., Ellendale, NORTH DAKOTA"
90002191,Avalon Theater,NORTH DAKOTA,Grand Forks,Larimore,210 Towner Ave.,ENTERTAINMENT/RECREATION; ARCHITECTURE,BUILDING,NA,90002191,"210 Towner Ave., Larimore, NORTH DAKOTA"
100009452,Chester Fritz Auditorium,NORTH DAKOTA,Grand Forks,Grand Forks,3475 University Ave.,ARCHITECTURE; ENTERTAINMENT/RECREATION; PERFORMING ARTS; EDUCATION,building,The Fritz,100009452,"3475 University Ave., Grand Forks, NORTH DAKOTA"
99001048,Metropolitan Opera House,NORTH DAKOTA,Grand Forks,Grand Forks,116 S. Third St.,ENTERTAINMENT/RECREATION,BUILDING,32GF1268,99001048,"116 S. Third St., Grand Forks, NORTH DAKOTA"
100012309,Petersburg Auditorium,NORTH DAKOTA,Nelson,Petersburg,116 5th Street,ARCHITECTURE; SOCIAL HISTORY,building,Petersburg Village Auditorium; City Auditorium; Town Hall,100012309,"116 5th Street, Petersburg, NORTH DAKOTA"
10000266,Walla Theater,NORTH DAKOTA,Pembina,Walhalla,909 Central Ave,ENTERTAINMENT/RECREATION; SOCIAL HISTORY,BUILDING,NA,10000266,"909 Central Ave, Walhalla, NORTH DAKOTA"
79003727,Lisbon Opera House,NORTH DAKOTA,Ransom,Lisbon,413 Main Ave.,COMMERCE; ARCHITECTURE; SOCIAL HISTORY; PERFORMING ARTS,BUILDING,J. C. Penney Building,79003727,"413 Main Ave., Lisbon, NORTH DAKOTA"
77001029,Mystic Theatre,NORTH DAKOTA,Slope,Marmarth,Main St.,ENTERTAINMENT/RECREATION; ARCHITECTURE,BUILDING,Marmarth Theatre,77001029,"Main St., Marmarth, NORTH DAKOTA"
85002831,Delchar Theater,NORTH DAKOTA,Traill,Mayville,20 W. Main St.,ENTERTAINMENT/RECREATION,BUILDING,NA,85002831,"20 W. Main St., Mayville, NORTH DAKOTA"
13000863,Edinburg WPA Auditorium,NORTH DAKOTA,Walsh,Edinburg,67 Main St.,ARCHITECTURE; SOCIAL HISTORY; ENTERTAINMENT/RECREATION,BUILDING,Edinburg Community Hall; Edinburg General Store,13000863,"67 Main St., Edinburg, NORTH DAKOTA"
04000299,Strand Theatre,NORTH DAKOTA,Walsh,Grafton,618 Hill Ave.,ARCHITECTURE; ENTERTAINMENT/RECREATION,BUILDING,"32 WA587;New Streand, Strand Twin Theatre, Deluxe Theatre; Strand Deluxe Theater",04000299,"618 Hill Ave., Grafton, NORTH DAKOTA"
78001997,Ray Opera House,NORTH DAKOTA,Williams,Ray,111 Main St.,ENTERTAINMENT/RECREATION; ARCHITECTURE; SOCIAL HISTORY,BUILDING,Charlson`s Store,78001997,"111 Main St., Ray, NORTH DAKOTA"
82001866,Ohio Theatre,OHIO,Allen,Lima,122 W. North St.,ARCHITECTURE,BUILDING,Ohio Theatre 2-Fantasia Disco,82001866,"122 W. North St., Lima, OHIO"
96001618,City Hall and Opera House,OHIO,Ashland,Loudonville,156 N. Water St.,ARCHITECTURE,BUILDING,Village Hall and Opera House,96001618,"156 N. Water St., Loudonville, OHIO"
76001364,Hayesville Opera House,OHIO,Ashland,Hayesville,1 E. Main St.,ART; PERFORMING ARTS,BUILDING,NA,76001364,"1 E. Main St., Hayesville, OHIO"
78002007,Stuart's Opera House,OHIO,Athens,Nelsonville,Public Sq. and Washington St.,ENTERTAINMENT/RECREATION; PERFORMING ARTS,BUILDING,NA,78002007,"Public Sq. and Washington St., Nelsonville, OHIO"
00000799,Dixon-Globe Opera House-Robinson-Schwenn Building,OHIO,Butler,Hamilton,221 High St.,COMMERCE; ECONOMICS; ARCHITECTURE,BUILDING,NA,00000799,"221 High St., Hamilton, OHIO"
100006652,Homestead Theatre Block,OHIO,Cuyahoga,Lakewood,11794-11816 Detroit Ave.,ENTERTAINMENT/RECREATION,building,Highland Studio; Phantasy Theater Complex,100006652,"11794-11816 Detroit Ave., Lakewood, OHIO"
11000365,LaSalle Theater Building,OHIO,Cuyahoga,Cleveland,819-829 E. 185th St.,ARCHITECTURE,BUILDING,NA,11000365,"819-829 E. 185th St., Cleveland, OHIO"
13000389,"Mayfield Theatre Building, The",OHIO,Cuyahoga,Cleveland,12300 Mayfield Rd.,ENTERTAINMENT/RECREATION,BUILDING,Matfield Art Theatre; Old Mayfield Theatre; New MayField Repertory Cinema,13000389,"12300 Mayfield Rd., Cleveland, OHIO"
11000670,Moreland Theater Building,OHIO,Cuyahoga,Cleveland,11810-11824 Buckeye Rd.,ARCHITECTURE; ENTERTAINMENT/RECREATION; EUROPEAN,BUILDING,NA,11000670,"11810-11824 Buckeye Rd., Cleveland, OHIO"
78002041,Playhouse Square Group,OHIO,Cuyahoga,Cleveland,"2067 E. 14th St.; 1422, 1501, 1515, 1621 Euclid Ave.",ART; ARCHITECTURE; PERFORMING ARTS,BUILDING,NA,78002041,"2067 E. 14th St.; 1422, 1501, 1515, 1621 Euclid Ave., Cleveland, OHIO"
82003559,Variety Store Building and Theatre,OHIO,Cuyahoga,Cleveland,11801-11825 Lorain Ave.,COMMERCE; ARCHITECTURE,BUILDING,NA,82003559,"11801-11825 Lorain Ave., Cleveland, OHIO"
82001435,Schine State Theatre,OHIO,Erie,Sandusky,101-109 Columbus Ave.,ARCHITECTURE,BUILDING,State Theatre,82001435,"101-109 Columbus Ave., Sandusky, OHIO"
75001398,American Insurance Union Citadel (Palace Theatre Amendment),OHIO,Franklin,Columbus,34 W. Broad St.,ARCHITECTURE,building,Leveque-Lincoln Tower; Keith-Albee Palace Theatre; Palace Theatre,75001398,"34 W. Broad St., Columbus, OHIO"
15000322,Drexel Theater,OHIO,Franklin,Bexley,2254 E. Main St.,ENTERTAINMENT/RECREATION; ARCHITECTURE,BUILDING,Drexel Theatre,15000322,"2254 E. Main St., Bexley, OHIO"
82001458,Great Southern Hotel and Theatre,OHIO,Franklin,Columbus,S. High and E. Main Sts.,ARCHITECTURE,BUILDING,NA,82001458,"S. High and E. Main Sts., Columbus, OHIO"
92001355,Lincoln Theatre,OHIO,Franklin,Columbus,77 E. Long St.,BLACK,BUILDING,Ogden Theatre and Ballroom,92001355,"77 E. Long St., Columbus, OHIO"
73001437,Ohio Theatre,OHIO,Franklin,Columbus,39 E. State St.,ARCHITECTURE; PERFORMING ARTS,BUILDING,NA,73001437,"39 E. State St., Columbus, OHIO"
83004295,Pythian Temple and James Pythian Theater,OHIO,Franklin,Columbus,861-867 Mt. Vernon Ave.,ARCHITECTURE; SOCIAL HISTORY,BUILDING,York Rite Masonic Temple,83004295,"861-867 Mt. Vernon Ave., Columbus, OHIO"
84003697,Cedarville Opera House,OHIO,Greene,Cedarville,78 N. Main St.,ENTERTAINMENT/RECREATION; POLITICS/GOVERNMENT; ARCHITECTURE,BUILDING,Cedarville Town Hall,84003697,"78 N. Main St., Cedarville, OHIO"
05000755,Fairborn Theatre,OHIO,Greene,Fairborn,34 S. Broad St.,ARCHITECTURE,BUILDING,Fairborn Twin Cinemas; Fairborn Performing Arts Center,05000755,"34 S. Broad St., Fairborn, OHIO"
07001093,Jamestown Opera House,OHIO,Greene,Jamestown,19 N. Limestone St.,PERFORMING ARTS; ENTERTAINMENT/RECREATION; ARCHITECTURE,BUILDING,Town Hall; Township House,07001093,"19 N. Limestone St., Jamestown, OHIO"
100001934,Main Theatre,OHIO,Hamilton,Mt. Healthy,7428 Hamilton Ave.,ENTERTAINMENT/RECREATION,building,NA,100001934,"7428 Hamilton Ave., Mt. Healthy, OHIO"
80004067,Palace Theatre,OHIO,Hamilton,Cincinnati,12 E. 6th St.,PERFORMING ARTS,BUILDING,NA,80004067,"12 E. 6th St., Cincinnati, OHIO"
100009302,Regal Theater,OHIO,Hamilton,Cincinnati,1201 Linn St.,ETHNIC HERITAGE-BLACK; ARCHITECTURE; ENTERTAINMENT/RECREATION,building,Casino Theatre,100009302,"1201 Linn St., Cincinnati, OHIO"
93000879,Twentieth Century Theatre,OHIO,Hamilton,Cincinnati,3023--3025 Madison Rd.,ARCHITECTURE,BUILDING,HAM-4389-12,93000879,"3023--3025 Madison Rd., Cincinnati, OHIO"
80003097,Bell's Opera House,OHIO,Highland,Hillsboro,109-119 S. High St.,INDUSTRY; INVENTION,BUILDING,NA,80003097,"109-119 S. High St., Hillsboro, OHIO"
100008039,Norwalk Theatre,OHIO,Huron,Norwalk,57 East Main St.,ARCHITECTURE,building,Schine’s Norwalk Theatre; Towne &amp; County Theatre; Norwalk  Main Street Theatre,100008039,"57 East Main St., Norwalk, OHIO"
75001448,Woodward Opera House,OHIO,Knox,Mount Vernon,Main and Vine Sts.,PERFORMING ARTS,BUILDING,NA,75001448,"Main and Vine Sts., Mount Vernon, OHIO"
08000149,Marlow Theatre,OHIO,Lawrence,Ironton,S. 3rd & Park Sts.,COMMERCE; ENTERTAINMENT/RECREATION; ARCHITECTURE,BUILDING,LAW-137-08,08000149,"S. 3rd & Park Sts., Ironton, OHIO"
81000446,Monroe Township Hall-Opera House,OHIO,Licking,Johnstown,1 S. Main St.,POLITICS/GOVERNMENT; ARCHITECTURE; PERFORMING ARTS,BUILDING,NA,81000446,"1 S. Main St., Johnstown, OHIO"
01000561,Schine's Holland Theatre,OHIO,Logan,Bellefontaine,125 E. Columbus St.,ARCHITECTURE,BUILDING,Holland Theatre; LOG-240-7,01000561,"125 E. Columbus St., Bellefontaine, OHIO"
78002109,Palace Theatre Building,OHIO,Lorain,Lorain,Broadway and 6th St.,ARCHITECTURE,BUILDING,NA,78002109,"Broadway and 6th St., Lorain, OHIO"
77001074,Burt's Theater,OHIO,Lucas,Toledo,719--723 Jefferson St.,ENTERTAINMENT/RECREATION; ARCHITECTURE,BUILDING,Country Palace,77001074,"719--723 Jefferson St., Toledo, OHIO"
98000318,Maumee Theater,OHIO,Lucas,Maumee,601 Conant St.,ARCHITECTURE,BUILDING,Maumee Indoor Theater,98000318,"601 Conant St., Maumee, OHIO"
06000198,Ohio Theatre,OHIO,Lucas,Toledo,3114 Lagrange St.,ARCHITECTURE; ENTERTAINMENT/RECREATION; EUROPEAN,building,St. Hedwig Coltural Center,06000198,"3114 Lagrange St., Toledo, OHIO"
87000686,Valentine Theater Building,OHIO,Lucas,Toledo,405--419 Saint Clair and 402--412 Adams,ARCHITECTURE,BUILDING,Renaissance Building,87000686,"405--419 Saint Clair and 402--412 Adams, Toledo, OHIO"
84003776,Liberty Theatre,OHIO,Mahoning,Youngstown,142 Federal Plaza W.,ARCHITECTURE,BUILDING,Paramount Theatre,84003776,"142 Federal Plaza W., Youngstown, OHIO"
84003781,"Stambaugh, Henry H., Memorial Auditorium",OHIO,Mahoning,Youngstown,1000 5th Ave.,ARCHITECTURE; PERFORMING ARTS,BUILDING,Stambaugh Auditorium,84003781,"1000 5th Ave., Youngstown, OHIO"
86001942,State Theater,OHIO,Mahoning,Youngstown,213 Federal Plaza W,COMMERCE; ARCHITECTURE,BUILDING,Agora,86001942,"213 Federal Plaza W, Youngstown, OHIO"
80003152,Warner Theater,OHIO,Mahoning,Youngstown,260 W. Federal Plaza,ENTERTAINMENT/RECREATION; ARCHITECTURE,BUILDING,Youngstown Symphony Center and Powers Auditorium,80003152,"260 W. Federal Plaza, Youngstown, OHIO"
76001486,Palace Theater,OHIO,Marion,Marion,272 W. Center St.,ART; PERFORMING ARTS,BUILDING,NA,76001486,"272 W. Center St., Marion, OHIO"
02001210,Medina Masonic Temple and Medina Theater,OHIO,Medina,Medina,120 N. Elmwood Ave. and 139 W. Liberty St.,ARCHITECTURE; ENTERTAINMENT/RECREATION; SOCIAL HISTORY,BUILDING,NA,02001210,"120 N. Elmwood Ave. and 139 W. Liberty St., Medina, OHIO"
100007396,Morvilius Opera House,OHIO,Mercer,Fort Recovery,101 North Wayne St.,ARCHITECTURE; ENTERTAINMENT/RECREATION,building,Adams Opera House; Fort Recovery Opera House,100007396,"101 North Wayne St., Fort Recovery, OHIO"
100010914,Monroe Theatre,OHIO,Monroe,Woodsfield,104 North Main Street,ARCHITECTURE; ENTERTAINMENT/RECREATION,building,NA,100010914,"104 North Main Street, Woodsfield, OHIO"
75001496,Classic Theater,OHIO,Montgomery,Dayton,815 W. 5th St.,ART; BLACK; PERFORMING ARTS,BUILDING,NA,75001496,"815 W. 5th St., Dayton, OHIO"
72001037,Victory Theater Building,OHIO,Montgomery,Dayton,138 N. Main St.,ENTERTAINMENT/RECREATION,BUILDING,Turner's Opera House;Music Hall;Grand Opera House;Victoria O,72001037,"138 N. Main St., Dayton, OHIO"
98000100,Camden City Hall and Opera House,OHIO,Preble,Camden,54 W. Central Ave.,ARCHITECTURE,BUILDING,NA,98000100,"54 W. Central Ave., Camden, OHIO"
83002040,Ohio Theatre,OHIO,Richland,Mansfield,"136 Park Ave., W.",ARCHITECTURE,BUILDING,136 Park Avenue West,83002040,"136 Park Ave., W., Mansfield, OHIO"
80003214,Soldiers and Sailors Memorial Building and Madison Theater,OHIO,Richland,Mansfield,"36 Park Ave., W.",ENTERTAINMENT/RECREATION; ARCHITECTURE,BUILDING,NA,80003214,"36 Park Ave., W., Mansfield, OHIO"
96001624,Eagles Building-Strand Theater,OHIO,Stark,Alliance,243 E. Main St.,ARCHITECTURE,BUILDING,Wallace Building,96001624,"243 E. Main St., Alliance, OHIO"
79001949,Palace Theater,OHIO,Stark,Canton,"605 Market Ave., N.",ENTERTAINMENT/RECREATION; ARCHITECTURE; SOCIAL HISTORY,BUILDING,NA,79001949,"605 Market Ave., N., Canton, OHIO"
73001537,Loew's Theatre,OHIO,Summit,Akron,182 S. Main St.,ENTERTAINMENT/RECREATION; ARCHITECTURE,BUILDING,Akron Civic Theatre,73001537,"182 S. Main St., Akron, OHIO"
100006162,Convoy Opera House-City Hall-Firehouse Building,OHIO,Van Wert,Convoy,111 South Main St.,ENTERTAINMENT/RECREATION; POLITICS/GOVERNMENT; SOCIAL HISTORY,building,NA,100006162,"111 South Main St., Convoy, OHIO"
100006150,Risingsun Town Hall and Opera House,OHIO,Wood,Risingsun,420 Main St.,ARCHITECTURE; ENTERTAINMENT/RECREATION,building,(OHI) WOO-00066-15),100006150,"420 Main St., Risingsun, OHIO"
84002934,Opera Block,OKLAHOMA,Adair,Westville,Main St.,COMMERCE; POLITICS/GOVERNMENT; PERFORMING ARTS,BUILDING,Cardinal Grocery,84002934,"Main St., Westville, OKLAHOMA"
06000117,Ardmore Municipal Auditorium,OKLAHOMA,Carter,Ardmore,220 West Broadway,ECONOMICS; ARCHITECTURE,BUILDING,NA,06000117,"220 West Broadway, Ardmore, OKLAHOMA"
84002978,Black Theater of Ardmore,OKLAHOMA,Carter,Ardmore,536 E. Main St.,BLACK; PERFORMING ARTS,BUILDING,Metropolitan A.M.E. Church,84002978,"536 E. Main St., Ardmore, OKLAHOMA"
84002981,Douglass High School Auditorium,OKLAHOMA,Carter,Ardmore,"800 M St., NE",BLACK; EDUCATION,BUILDING,NA,84002981,"800 M St., NE, Ardmore, OKLAHOMA"
78002227,Sooner Theater Building,OKLAHOMA,Cleveland,Norman,101 E. Main St.,ARCHITECTURE; PERFORMING ARTS,BUILDING,NA,78002227,"101 E. Main St., Norman, OKLAHOMA"
88001382,Coalgate School Gymnasium-Auditorium,OKLAHOMA,Coal,Coalgate,Fox and Frey Sts.,ECONOMICS; EDUCATION; ARCHITECTURE; SOCIAL HISTORY,BUILDING,NA,88001382,"Fox and Frey Sts., Coalgate, OKLAHOMA"
16000619,Klingensmith Park Amphitheater,OKLAHOMA,Creek,Bristow,"W. 7th, W. 5th & Country Club Dr.",ECONOMICS; ENTERTAINMENT/RECREATION,district,"Bristow Amphitheater, Lake Massena Amphitheater",16000619,"W. 7th, W. 5th & Country Club Dr., Bristow, OKLAHOMA"
100001590,"Briggs, Eugene S., Auditorium",OKLAHOMA,Garfield,Enid,2450 E. Maine,EDUCATION; ARCHITECTURE,building,NA,100001590,"2450 E. Maine, Enid, OKLAHOMA"
88001384,Stigler School Gymnasium-Auditorium,OKLAHOMA,Haskell,Stigler,Fourth and E Sts.,ECONOMICS; ARCHITECTURE; SOCIAL HISTORY,BUILDING,NA,88001384,"Fourth and E Sts., Stigler, OKLAHOMA"
88001389,Spaulding School Gymnasium-Auditorium,OKLAHOMA,Hughes,Spaulding,Section Line Hwy. and Second St.,ECONOMICS; EDUCATION; ARCHITECTURE; SOCIAL HISTORY,BUILDING,NA,88001389,"Section Line Hwy. and Second St., Spaulding, OKLAHOMA"
15000327,Hayes-Kennedy-Rivoli Theater Building,OKLAHOMA,Kay,Blackwell,122-124 S. Main,ARCHITECTURE; ENTERTAINMENT/RECREATION,BUILDING,"Equity Building, Equity Plaza Apartments",15000327,"122-124 S. Main, Blackwell, OKLAHOMA"
84000455,Poncan Theatre,OKLAHOMA,Kay,Ponca City,104 E. Grand Ave.,ARCHITECTURE,BUILDING,NA,84000455,"104 E. Grand Ave., Ponca City, OKLAHOMA"
100005557,"Old City Hall, Theater and Masonic Lodge",OKLAHOMA,Le Flore,Heavener,401 East 1st St.,ARCHITECTURE,building,NA,100005557,"401 East 1st St., Heavener, OKLAHOMA"
88001404,Poteau School Gymnasium-Auditorium,OKLAHOMA,Le Flore,Poteau,Walter and Parker Sts.,ECONOMICS; EDUCATION; ARCHITECTURE; SOCIAL HISTORY,BUILDING,NA,88001404,"Walter and Parker Sts., Poteau, OKLAHOMA"
