Post number,Subject,Body,Attachment link,Location,Latitude,Longitude,Post color,Created At (UTC),Updated At (UTC)
1,363. Voya ,"New York, NY, USA
",http://www.voya.com/,"New York, NY, USA",40.7127753,-74.0059728,White,"Sep 20, 2019 08:17am","Sep 20, 2019 08:17am"
2,64. Adobe,"San Jose, CA, USA
",http://www.adobe.com/,"San Jose, CA, USA",37.3382082,-121.88632860000001,White,"Sep 20, 2019 08:09am","Sep 26, 2023 11:23pm"
3,"53. Walt Disney, Burbank, CA, USA","",http://www.thewaltdisneycompany.com/,"Burbank, CA, USA",34.1808392,-118.30896610000002,White,"Sep 20, 2019 06:57am","Sep 20, 2019 06:57am"
4,360. Glenworth Financial,"Richmond, VA, USA
",https://www.genworth.com/,"Richmond, VA, USA",37.5407246,-77.4360481,White,"Sep 20, 2019 12:54am","Sep 26, 2023 11:22pm"
5,"374. Expeditors, 3rd Avenue, Seattle, WA, USA","",http://www.expeditors.com/,"Expeditors, 3rd Avenue, Seattle, WA, USA",47.60583800000001,-122.33468299999998,White,"Sep 16, 2019 09:25am","Sep 23, 2025 08:47am"
6,"373. Dana Incorporated, Longbow Drive, Maumee, OH, USA","",http://www.dana.com/,"Dana Incorporated, Longbow Drive, Maumee, OH, USA",41.574963,-83.68425609999997,White,"Sep 16, 2019 09:25am","Sep 16, 2019 09:48am"
7,"372. Jefferies Financial Group, Madison Avenue, New York, NY, USA","",http://www.jefferies.com/,"Jefferies Financial Group, Madison Avenue, New York, NY, USA",40.760264,-73.97451639999997,White,"Sep 16, 2019 09:25am","Sep 16, 2019 09:48am"
8,"370. Wesco International Inc, West Station Square Drive, Pittsburgh, PA, USA","",http://www.wesco.com/,"Wesco International Inc, West Station Square Drive, Pittsburgh, PA, USA",40.4337234,-80.00578530000001,White,"Sep 16, 2019 09:25am","Sep 16, 2019 09:48am"
9,"371. Huntington Ingalls Industries, Washington Avenue, Newport News, VA, USA","",http://www.huntingtoningalls.com/,"Huntington Ingalls Industries, Washington Avenue, Newport News, VA, USA",36.9882362,-76.43717830000003,White,"Sep 16, 2019 09:25am","Sep 16, 2019 09:48am"
10,369. Amphenol,"Wallingford, Conn, USA
",http://www.amphenol.com/,"Wallingford, Conn, USA",41.4570108,-72.82307359999999,White,"Sep 16, 2019 09:25am","Sep 16, 2019 09:48am"
11,"379. United Rentals,Stamford, CT, USA","",https://en.wikipedia.org/wiki/United_Rentals,"United Rentals, Selleck Street, Stamford, CT, USA",41.04067709999999,-73.55721870000002,White,"Sep 16, 2019 09:25am","Sep 26, 2023 11:21pm"
12,"378. Assurant, New York, NY, USA","",http://www.assurant.com/,"Assurant, New York, NY, USA",40.70779160000001,-74.0089405,White,"Sep 16, 2019 09:25am","Sep 16, 2019 09:48am"
13,368. Alaska Air Group,"Seattle, Wash, USA
",http://www.alaskaair.com/,"Seattle, Wash, USA",47.6062095,-122.3320708,White,"Sep 16, 2019 09:25am","Sep 16, 2019 09:48am"
14,"377. SpartanNash Company,  Byron Center, MI, USA","",http://www.spartannash.com/,"SpartanNash Company, 76th Street Southwest, Byron Center, MI, USA",42.825551,-85.68461400000001,White,"Sep 16, 2019 09:25am","Sep 16, 2019 09:48am"
15,"376. Darden Restaurants, Darden Center Drive, Orlando, FL, USA","",http://www.darden.com/,"Darden Restaurants, Darden Center Drive, Orlando, FL, USA",28.4180207,-81.42484430000002,White,"Sep 16, 2019 09:25am","Sep 16, 2019 09:48am"
16,367. THOR INDUSTRIES,"Elkhart, Ind, USA
",http://www.thorindustries.com/,"Elkhart, Ind, USA",41.6819935,-85.97666709999999,White,"Sep 16, 2019 09:25am","Sep 16, 2019 09:48am"
17,"375. EMCOR Norwalk, Connecticut, USA","",http://www.emcorgroup.com/,"EMCOR Group, Merritt 7, Norwalk, Connecticut, USA",41.14937389999999,-73.42692540000002,White,"Sep 16, 2019 09:25am","Sep 16, 2019 09:48am"
18,366. Masco Corp,"Livonia, Mich, USA
",http://www.masco.com/,"Livonia, Mich, USA",42.36837,-83.35270969999999,White,"Sep 16, 2019 09:25am","Sep 20, 2019 12:20am"
19,"365. Caesars Entertainment, Caesars Palace Drive, Las Vegas, NV, USA","",http://www.caesars.com/,"Caesars Entertainment, Caesars Palace Drive, Las Vegas, NV, USA",36.1165658,-115.17524029999998,White,"Sep 16, 2019 09:25am","Sep 16, 2019 09:48am"
20,"399. JetBlue Airways Corporation, Queens Plaza North, Long Island City, NY, USA","",http://www.jetblue.com/,"JetBlue Airways Corporation, Queens Plaza North, Long Island City, NY, USA",40.7509337,-73.93859780000003,White,"Sep 16, 2019 09:25am","Sep 16, 2019 09:48am"
21,"398. WEC Energy Group, West Michigan Street, Milwaukee, WI, USA","",http://www.wecenergygroup.com/,"WEC Energy Group, West Michigan Street, Milwaukee, WI, USA",43.0370226,-87.91385330000003,White,"Sep 16, 2019 09:25am","Sep 16, 2019 09:48am"
22,"397. W. R. Berkley Corporation, Steamboat Road, Greenwich, CT, USA","",http://www.wrberkley.com/,"W. R. Berkley Corporation, Steamboat Road, Greenwich, CT, USA",41.018681,-73.62232240000003,White,"Sep 16, 2019 09:25am","Sep 16, 2019 09:48am"
23,"396. EnLink Midstream, Routh Street, Dallas, TX, USA","",http://www.enlink.com/,"EnLink Midstream, Routh Street, Dallas, TX, USA",32.7920752,-96.7951114,White,"Sep 16, 2019 09:25am","Sep 16, 2019 09:48am"
24,"391. Anixter Glenview, Patriot Boulevard, Glenview, IL, USA","",http://www.anixter.com/,"Anixter Glenview, Patriot Boulevard, Glenview, IL, USA",42.09746980000001,-87.8239375,White,"Sep 16, 2019 09:25am","Sep 20, 2019 12:51am"
25,"395 Osh Kosh, Oshkosh, WI, USA","",http://www.bldr.com/,"Oshkosh, WI, USA",44.0247062,-88.54261359999998,White,"Sep 16, 2019 09:25am","Sep 16, 2019 09:48am"
26,"394. Builders FirstSource, Bryan Street, Dallas, TX, USA","",http://www.bldr.com/,"Builders FirstSource, Bryan Street, Dallas, TX, USA",32.78536,-96.796337,White,"Sep 16, 2019 09:25am","Sep 16, 2019 09:48am"
27,363. Ryder System,"Miami, Fla, USA
",http://www.ryder.com/,"Miami, Fla, USA",25.7616798,-80.19179020000001,White,"Sep 16, 2019 09:25am","Sep 16, 2019 09:48am"
28,"393. Dean Foods Company, North Haskell Avenue, Dallas, TX, USA","",http://www.deanfoods.com/,"Dean Foods Company, North Haskell Avenue, Dallas, TX, USA",32.8055096,-96.79237940000002,White,"Sep 16, 2019 09:25am","Sep 16, 2019 09:48am"
29,"392. PPL, Allentown, PA, USA","",http://www.pplweb.com/,"PPL Walbert Training Center, Church Road, Allentown, PA, USA",40.6081366,-75.57044940000003,White,"Sep 16, 2019 09:25am","Sep 16, 2019 09:48am"
30,362. Yum China Holdings,"Plano, Texas, USA
",http://ir.yumchina.com/,"Plano, Texas, USA",33.01984309999999,-96.69888559999998,White,"Sep 16, 2019 09:25am","Sep 16, 2019 09:48am"
31,"391. Hershey, PA, USA","",http://www.thehersheycompany.com/,"Hershey, PA, USA",40.28592389999999,-76.65024679999999,White,"Sep 16, 2019 09:25am","Sep 16, 2019 09:48am"
32,"390. Alliance Data Systems, Plano, TX, USA","",http://www.alliancedata.com/,"Plano, TX, USA",33.01984309999999,-96.69888559999998,White,"Sep 16, 2019 09:25am","Sep 16, 2019 09:48am"
33,"389. Berry Global, Oakley Street, Evansville, IN, USA","",http://www.berryglobal.com/,"Berry Global, Oakley Street, Evansville, IN, USA",37.9789909,-87.57264350000003,White,"Sep 16, 2019 09:25am","Sep 16, 2019 09:48am"
34,361. Fidelity National Information Services,"Jacksonville, FL, USA
",http://www.fisglobal.com/,"Jacksonville, FL, USA",30.3321838,-81.65565099999998,White,"Sep 16, 2019 09:25am","Sep 16, 2019 09:48am"
35,"388. Tractor Supply Company  Brentwood, TN, USA","",http://www.zimmerbiomet.com/,"Tractor Supply Company - Store Support Center, Virginia Way, Brentwood, TN, USA",36.0322969,-86.81283719999999,White,"Sep 16, 2019 09:25am","Sep 16, 2019 09:48am"
36,"387. Zimmer Biomet Warsaw, IN, USA","",http://www.zimmerbiomet.com/,"Zimmer Biomet Building 5, West Center Street, Warsaw, IN, USA",41.2405012,-85.88388980000002,White,"Sep 16, 2019 09:25am","Sep 16, 2019 09:48am"
37,"386. Conagra Brands, Chicago, IL, USA","",http://www.conagrabrands.com/,"Chicago, IL, USA",41.8781136,-87.62979819999998,White,"Sep 16, 2019 09:25am","Sep 16, 2019 09:48am"
38,"385. Foot Locker, Broadway, New York, NY, USA","",https://www.northerntrust.com/united-states/home,"Foot Locker, Broadway, New York, NY, USA",40.7551834,-73.98631769999997,White,"Sep 16, 2019 09:25am","Sep 26, 2023 11:20pm"
39,359. Dick’s Sporting Goods,"Coraopolis, PA, USA
",http://www.dickssportinggoods.com/,"Coraopolis, PA, USA",40.5184013,-80.16672470000003,White,"Sep 16, 2019 09:25am","Sep 16, 2019 09:48am"
40,"384. Fifth Third Bank, OH, USA","",http://www.53.com/,"Fifth Third Bank, Kingsley Drive, Cincinnati, OH, USA",39.16698109999999,-84.4114303,White,"Sep 16, 2019 09:25am","Sep 16, 2019 09:48am"
41,"358. Eversource, Station Drive, Westwood, MA, USA","",http://www.eversource.com/,"Eversource, Station Drive, Westwood, MA, USA",42.2029952,-71.1596834,White,"Sep 16, 2019 09:25am","Sep 16, 2019 09:48am"
42,"383. Cheniere Energy Inc, Milam Street, Houston, TX, USA","",http://www.cheniere.com/,"Cheniere Energy Inc, Milam Street, Houston, TX, USA",29.7601536,-95.3653756,White,"Sep 16, 2019 09:25am","Sep 16, 2019 09:48am"
43,"357. National Oilwell Varco, Cypress Creek Road, Cedar Park, TX, USA","",http://www.nov.com/,"National Oilwell Varco, Cypress Creek Road, Cedar Park, TX, USA",30.4899915,-97.82765610000001,White,"Sep 16, 2019 09:25am","Sep 16, 2019 09:48am"
44,"382. Auto-Owners Insurance, Anacapri Drive, Lansing, MI, USA","",http://www.auto-owners.com/,"Auto-Owners Insurance, Anacapri Drive, Lansing, MI, USA",42.7218607,-84.63845750000002,White,"Sep 16, 2019 09:25am","Sep 16, 2019 09:48am"
45,"381. Erie Insurance Arena, French Street, Erie, PA, USA","",http://www.erieinsurance.com/,"Erie Insurance Arena, French Street, Erie, PA, USA",42.1280011,-80.08088889999999,White,"Sep 16, 2019 09:25am","Sep 16, 2019 09:48am"
46,356. Jones Financial (Edward Jones),"Des Peres, MO, USA
",http://www.edwardjones.com/,"Des Peres, MO, USA",38.6008862,-90.43289679999998,White,"Sep 16, 2019 09:25am","Sep 16, 2019 09:48am"
47,"380. Liberty Media Corporation, Liberty Boulevard, Englewood, CO, USA","",http://www.libertymedia.com/,"Liberty Media Corporation, Liberty Boulevard, Englewood, CO, USA",39.553121,-104.84617700000001,White,"Sep 16, 2019 09:25am","Sep 16, 2019 09:48am"
48,355. Frontier Communications,"",http://www.frontier.com/,"Norwalk, CT, USA",41.11774399999999,-73.40815750000002,White,"Sep 16, 2019 09:25am","Sep 16, 2019 09:48am"
49,"500. Levi's Store, San Francisco, CA, USA","",http://www.levistrauss.com/,"Levi's Store Market Street, Market Street, San Francisco, CA, USA",37.7852456,-122.40613450000001,White,"Sep 16, 2019 09:25am","Sep 16, 2019 09:48am"
50,"354. J.B. Hunt Transport Services, Inc., J B Hunt Corporate Drive, Lowell, AR, USA","",http://www.jbhunt.com/,"J.B. Hunt Transport Services, Inc., J B Hunt Corporate Drive, Lowell, AR, USA",36.2447313,-94.14944379999997,White,"Sep 16, 2019 09:25am","Sep 16, 2019 09:48am"
51,"499. Peabody Energy, St. Louis, MO, USA","",http://www.peabodyenergy.com/,"Peabody Energy, Market Street, St. Louis, MO, USA",38.626689,-90.19256510000002,White,"Sep 16, 2019 09:25am","Sep 16, 2019 09:48am"
52,"498. Western Union,Denver, CO, USA","",http://www.westernunion.com/,"Western Union, East Colfax Avenue, Denver, CO, USA",39.7402176,-104.97594950000001,White,"Sep 16, 2019 09:25am","Sep 16, 2019 09:48am"
53,353. UNIVAR,"Downers Grove, Ill, USA
",http://www.univarsolutions.com/,"Downers Grove, Ill, USA",41.8089191,-88.0111746,White,"Sep 16, 2019 09:25am","Sep 16, 2019 09:48am"
54,352. WESTLAKE CHEMICAL,"Houston, Texas, USA
",http://www.westlake.com/,"Houston, Texas, USA",29.7604267,-95.3698028,White,"Sep 16, 2019 09:25am","Sep 16, 2019 09:48am"
55,351. Thrivent Financial for Lutherans,"Minneapolis, Minn, USA
",http://www.thrivent.com/,"Minneapolis, Minn, USA",44.977753,-93.26501080000003,White,"Sep 16, 2019 09:25am","Sep 16, 2019 09:48am"
56,350. Rockwell Collins,"",http://www.collinsaerospace.com/,"West Palm Beach, FL, USA",26.7153424,-80.05337459999998,White,"Sep 16, 2019 09:25am","Sep 16, 2019 09:48am"
57,"349. Campbell Soup Company, Campbell Place, Camden, NJ, USA","",http://www.campbellsoupcompany.com/,"Campbell Soup Company, Campbell Place, Camden, NJ, USA",39.9390315,-75.1080212,White,"Sep 16, 2019 09:25am","Sep 16, 2019 09:48am"
58,348. WILLIAMS,"Tulsa, Okla, USA
",http://www.williams.com/,"Tulsa, Okla, USA",36.15398159999999,-95.992775,White,"Sep 16, 2019 09:25am","Sep 16, 2019 09:48am"
59,"347. Veritiv Corporation, Governors Lake Parkway, Norcross, GA, USA","",http://www.veritivcorp.com/,"Veritiv Corporation, Governors Lake Parkway, Norcross, GA, USA",33.92977500000001,-84.25124829999999,White,"Sep 16, 2019 09:25am","Sep 16, 2019 09:48am"
60,346. GameStop,"Grapevine, Texas, USA
",http://www.gamestop.com/,"Grapevine, Texas, USA",32.9342919,-97.07806540000001,White,"Sep 16, 2019 09:25am","Sep 16, 2019 09:48am"
61,"497. Navient, Wilmington, DE, USA","",http://www.navient.com/,"Navient, Justison Street, Wilmington, DE, USA",39.7382681,-75.55915199999998,White,"Sep 16, 2019 09:25am","Sep 16, 2019 09:48am"
62,"496. Simon Property Group, East Washington Street, Indianapolis, IN, USA","",http://www.simon.com/,"Simon Property Group, East Washington Street, Indianapolis, IN, USA",39.7669989,-86.16216810000003,White,"Sep 16, 2019 09:25am","Sep 16, 2019 09:48am"
63,"495. Williams-Sonoma, Post Street, San Francisco, CA, USA","",http://www.williams-sonomainc.com/,"Williams-Sonoma, Post Street, San Francisco, CA, USA",37.7886383,-122.40749840000001,White,"Sep 16, 2019 09:25am","Sep 16, 2019 09:48am"
64,"494. Yum Brands, Louisville, KY, USA","",http://www.yum.com/,"Louisville, KY, USA",38.25266469999999,-85.75845570000001,White,"Sep 16, 2019 09:25am","Sep 16, 2019 09:48am"
65,"493. Windstream Holdings Little Rock, AR, USA","",http://www.windstream.com/,"Little Rock, AR, USA",34.7464809,-92.28959479999997,White,"Sep 16, 2019 09:25am","Sep 16, 2019 09:48am"
66,345. Hilton Worldwide Holdings,"McLean, VA, USA
",http://www.hilton.com/,"McLean, VA, USA",38.93386760000001,-77.17726040000002,White,"Sep 16, 2019 09:25am","Sep 16, 2019 09:48am"
67,"492. Harley-Davidson Museum, West Canal Street, Milwaukee, WI, USA","",http://www.harley-davidson.com/,"Harley-Davidson Museum, West Canal Street, Milwaukee, WI, USA",43.0316706,-87.91652440000001,White,"Sep 16, 2019 09:25am","Sep 16, 2019 09:48am"
68,"491. First American Financial, Santa Ana, CA, USA","",http://www.firstam.com/,"First American Financial, First American Way, Santa Ana, CA, USA",33.702007,-117.860141,White,"Sep 16, 2019 09:25am","Sep 16, 2019 09:48am"
69,344. Air Products & Chemicals,"Allentown, PA, USA
",http://www.airproducts.com/,"Allentown, PA, USA",40.6022939,-75.4714098,White,"Sep 16, 2019 09:25am","Sep 16, 2019 09:48am"
70,"489. TreeHouse Foods, Inc., Spring Road, Oak Brook, IL, USA","","","TreeHouse Foods, Inc., Spring Road, Oak Brook, IL, USA",41.8494532,-87.94730670000001,White,"Sep 16, 2019 09:25am","Sep 16, 2019 09:48am"
71,"488. Fiserv, Inc., Fiserv Drive, Brookfield, WI, USA","",http://www.fiserv.com/,"Fiserv, Inc., Fiserv Drive, Brookfield, WI, USA",43.0338095,-88.1409438,White,"Sep 16, 2019 09:25am","Sep 16, 2019 09:48am"
72,"487. Zoetis Inc., Sylvan Way, Parsippany, New Jersey, USA","",http://www.zoetis.com/,"Zoetis Inc., Sylvan Way, Parsippany, New Jersey, USA",40.8470715,-74.44477719999998,White,"Sep 16, 2019 09:25am","Sep 16, 2019 09:48am"
73,342. Brighthouse Financial,"Charlotte, N.C., USA
",http://www.brighthousefinancial.com/,"Charlotte, N.C., USA",35.2270869,-80.84312669999997,White,"Sep 16, 2019 09:25am","Sep 16, 2019 09:48am"
74,"486. Ingredion, Westchester, IL, USA","",http://www.ingredion.com/,"Ingredion, Westbrook Corporate Center, Westchester, IL, USA",41.8453955,-87.90528560000001,White,"Sep 16, 2019 09:25am","Sep 16, 2019 09:48am"
75,"485. ON Semiconductor, Phoenix, AZ, USA","",http://www.onsemi.com/,"ON Semiconductor, East McDowell Road, Phoenix, AZ, USA",33.4636186,-111.9701255,White,"Sep 16, 2019 09:25am","Sep 16, 2019 09:48am"
76,"","New York, N.Y., USA
",http://www.newscorp.com/,"New York, N.Y., USA",40.7127753,-74.0059728,White,"Sep 16, 2019 09:25am","Sep 16, 2019 09:48am"
77,"484. Tapestry, New York, NY, USA","",http://www.tapestry.com/,"New York, NY, USA",40.7127753,-74.0059728,White,"Sep 16, 2019 09:25am","Sep 16, 2019 09:48am"
78,340. Peter Kiewit Sons’,"Omaha, Neb, USA
",http://www.kiewit.com/,"Omaha, Neb, USA",41.2565369,-95.93450339999998,White,"Sep 16, 2019 09:25am","Sep 16, 2019 09:48am"
79,"483. NetApp, Sunnyvale, CA, USA","",http://www.netapp.com/,"NetApp, Crossman Avenue, Sunnyvale, CA, USA",37.4149198,-122.0095976,White,"Sep 16, 2019 09:25am","Sep 16, 2019 09:48am"
80,"482. Intuit, Mountain View, CA, USA","",http://www.intuit.com/,"Intuit Building 20, Marine Way, Mountain View, CA, USA",37.42836249999999,-122.097623,White,"Sep 16, 2019 09:25am","Sep 16, 2019 09:48am"
81,"481. Old Republic International Corporation, Michigan Avenue, Chicago, IL, USA","",http://www.oldrepublic.com/,"Old Republic International Corporation, Michigan Avenue, Chicago, IL, USA",41.887068,-87.6241579,White,"Sep 16, 2019 09:25am","Sep 16, 2019 09:48am"
82,"480. Graphic Packaging International, Atlanta, GA, USA","","","Graphic Packaging International, Mike Padgett Highway, Augusta, GA, USA",33.327532,-81.95409699999999,White,"Sep 16, 2019 09:25am","Sep 16, 2019 09:48am"
83,"338. AVIS, Parsippany, NJ, USA","http://www.avisbudgetgroup.com/http://www.avisbudgetgroup.com/
",http://www.avisbudgetgroup.com/,"Parsippany Boulevard, Parsippany, NJ, USA",40.867239,-74.42294170000002,White,"Sep 16, 2019 09:25am","Sep 20, 2019 06:01am"
84,"337. Vistra/TXU Energy Corporate Office, Sierra Drive, Irving, TX, USA","",http://www.vistraenergy.com/,"Vistra/TXU Energy Corporate Office, Sierra Drive, Irving, TX, USA",32.898375,-96.96423759999999,White,"Sep 16, 2019 09:25am","Sep 16, 2019 09:48am"
85,"479. Hd Supply Holdings Inc,  Atlanta, GA, USA","",http://www.hdsupply.com/,"Hd Supply Holdings Inc, Cumberland Parkway Southeast, Atlanta, GA, USA",33.8772177,-84.4728859,White,"Sep 16, 2019 09:25am","Sep 16, 2019 09:48am"
86,"478. Realogy Holdings Corp., Park Avenue, Madison, NJ, USA","",http://www.realogy.com/,"Realogy Holdings Corp., Park Avenue, Madison, NJ, USA",40.7716197,-74.42318549999999,White,"Sep 16, 2019 09:25am","Sep 16, 2019 09:48am"
87,"477. Clorox Co, Broadway, Oakland, CA, USA","",http://www.thecloroxcompany.com/,"Clorox Co, Broadway, Oakland, CA, USA",37.80358210000001,-122.27211649999998,White,"Sep 16, 2019 09:25am","Sep 16, 2019 09:48am"
88,"476. Polaris Industries Inc, Highway 55, Medina, MN, USA","",http://www.polaris.com/,"Polaris Industries Inc, Highway 55, Medina, MN, USA",45.05750700000001,-93.57653670000002,White,"Sep 16, 2019 09:25am","Sep 16, 2019 09:48am"
89,"475. Booz Allen Hamilton Inc, , McLean, VA, USA","","","Booz Allen Hamilton Inc, Greensboro Drive, McLean, VA, USA",38.9218202,-77.2319233,White,"Sep 16, 2019 09:25am","Sep 16, 2019 09:48am"
90,"474. L3Harris Technologies: Communication Systems-West, 2200 West, Salt Lake City, UT, USA","",http://www.harris.com/,"L3Harris Technologies: Communication Systems-West, 2200 West, Salt Lake City, UT, USA",40.7835097,-111.95278480000002,White,"Sep 16, 2019 09:25am","Sep 16, 2019 09:48am"
91,"473. Ralph Lauren New York, NY, USA","",http://www.ralphlauren.com/,"Ralph Lauren Men's, Madison Avenue, New York, NY, USA",40.7715155,-73.96536559999998,White,"Sep 16, 2019 09:25am","Sep 16, 2019 09:48am"
92,"472. Analog Devices, Technology Way, Norwood, MA, USA","",http://www.analog.com/,"Analog Devices, Technology Way, Norwood, MA, USA",42.2104866,-71.18062359999999,White,"Sep 16, 2019 09:25am","Sep 16, 2019 09:48am"
93,"471. Post Holdings Inc, South Hanley Road, St. Louis, MO, USA","","","Post Holdings Inc, South Hanley Road, St. Louis, MO, USA",38.6165266,-90.334968,White,"Sep 16, 2019 09:25am","Sep 16, 2019 09:48am"
94,"470. S and P Global, New York, NY, USA","",http://www.spglobal.com/,"The McGraw-Hill Companies Business Week, Pennsylvania Plaza, New York, NY, USA",40.74997189999999,-73.99216760000002,White,"Sep 16, 2019 09:25am","Sep 16, 2019 09:48am"
95,"469. Intercontinental Exchange, New Northside Drive, Atlanta, GA, USA","",http://www.ameren.com/,"Intercontinental Exchange, New Northside Drive, Atlanta, GA, USA",33.9088822,-84.4307488,White,"Sep 16, 2019 09:25am","Sep 16, 2019 09:48am"
96,"478. Ameren Corporation,  St. Louis, MO, USA","",http://www.ameren.com/,"Ameren Corporation, Chouteau Avenue, St. Louis, MO, USA",38.6224443,-90.20955879999997,White,"Sep 16, 2019 09:25am","Sep 16, 2019 09:48am"
97,"467. Franklin Templeton Investments, San Mateo, CA, USA","",http://www.franklinresources.com/,"Franklin Templeton Investments, Franklin Parkway, San Mateo, CA, USA",37.5437749,-122.29422740000001,White,"Sep 16, 2019 09:25am","Sep 16, 2019 09:48am"
98,"166. iHeartMedia San Antonio, San Antonio, TX, USA","",http://www.iheartmedia.com/,"iHeartMedia San Antonio, Stone Oak Parkway, San Antonio, TX, USA",29.6476256,-98.4542381,White,"Sep 16, 2019 09:25am","Sep 16, 2019 09:48am"
99,"465. NCR Global, Atlanta, GA, USA","",http://www.ncr.com/,"NCR Global Headquarters, Spring Street Northwest, Atlanta, GA, USA",33.7791502,-84.38960150000003,White,"Sep 16, 2019 09:25am","Sep 16, 2019 09:48am"
100,"464. Beacon Roofing Supply Inc, Huntmar Park Drive, Herndon, VA, USA","",http://www.abm.com/,"Beacon Roofing Supply Inc, Huntmar Park Drive, Herndon, VA, USA",38.9634821,-77.38151849999997,White,"Sep 16, 2019 09:25am","Sep 16, 2019 09:48am"
101,"463. ABM Industries, New York, NY, USA","",http://www.abm.com/,"New York, NY, USA",40.7127753,-74.0059728,White,"Sep 16, 2019 09:25am","Sep 16, 2019 09:48am"
102,"336. Mutual of Omaha® Insurance Co., Dodge Street, Omaha, NE, USA","",http://www.mutualofomaha.com/,"Mutual of Omaha® Insurance Co., Dodge Street, Omaha, NE, USA",41.2585024,-95.96226899999999,White,"Sep 16, 2019 09:25am","Sep 16, 2019 09:48am"
103,"462. M&T Bank Buffalo, NY, USA","",http://www.mtb.com/,"M&T Bank Corporate Office, Commerce Drive, Buffalo, NY, USA",43.02708690000001,-78.80044829999997,White,"Sep 16, 2019 09:25am","Sep 16, 2019 09:48am"
104,"461. HESS New York, NY, USA","",http://www.hess.com/,"New York, NY, USA",40.7127753,-74.0059728,White,"Sep 16, 2019 09:25am","Sep 16, 2019 09:48am"
105,"460. Advanced Micro Devices, Augustine Drive, Santa Clara, CA, USA","",http://www.amd.com/,"Advanced Micro Devices, Augustine Drive, Santa Clara, CA, USA",37.3829254,-121.97038420000001,White,"Sep 16, 2019 09:25am","Sep 16, 2019 09:48am"
106,335. AGCO,"Duluth, GA, USA
",http://www.agcocorp.com/,"Duluth, GA, USA",34.0028786,-84.14463760000001,White,"Sep 16, 2019 09:25am","Sep 16, 2019 09:48am"
107,"459. Cintas Center, Herald Avenue, Cincinnati, OH, USA","",http://www.cintas.com/,"Cintas Center, Herald Avenue, Cincinnati, OH, USA",39.15036159999999,-84.47184149999998,White,"Sep 16, 2019 09:25am","Sep 16, 2019 09:48am"
108,"458. Dillard's, Little Rock AR, USA","",http://www.ascenaretail.com/,"Dillard's, West Markham Street, Little Rock, AR, USA",34.75346740000001,-92.34189630000003,White,"Sep 16, 2019 09:25am","Sep 16, 2019 09:48am"
109,334. COTY,"New York, N.Y., USA
",http://www.coty.com/,"New York, N.Y., USA",40.7127753,-74.0059728,White,"Sep 16, 2019 09:25am","Sep 16, 2019 09:48am"
110,"457. Ascena Retail Group Inc (ASNA),Mahwah, NJ, USA","",http://www.ascenaretail.com/,"Ascena Retail Group Inc (ASNA), MacArthur Boulevard, Mahwah, NJ, USA",41.0738813,-74.17128300000002,White,"Sep 16, 2019 09:25am","Sep 16, 2019 09:48am"
111,"333. Pioneer Natural Resources Company, North O'Connor Boulevard, Irving, TX, USA","",http://www.pxd.com/,"Pioneer Natural Resources Company, North O'Connor Boulevard, Irving, TX, USA",32.8712639,-96.93885610000001,White,"Sep 16, 2019 09:25am","Sep 16, 2019 09:48am"
112,"456. Marathon Oil, Houston, TX, USA","",http://www.marathonoil.com/,"Marathon Oil Tower, San Felipe Street, Houston, TX, USA",29.74935640000001,-95.47157049999998,White,"Sep 16, 2019 09:25am","Sep 16, 2019 09:48am"
113,332. First Data,"New York, N.Y., USA
",http://www.firstdata.com/,"New York, N.Y., USA",40.7127753,-74.0059728,White,"Sep 16, 2019 09:25am","Sep 16, 2019 09:48am"
114,"455. Seaboard Corporation Shawnee Mission, KS, USA","",http://www.seaboardcorp.com/,"Seaboard Corporation, West 67th Street, Shawnee Mission, KS, USA",39.0081599,-94.69095700000003,White,"Sep 16, 2019 09:25am","Sep 16, 2019 09:48am"
115,331. Hertz Global Holdings,"Estero, Fla, USA
",http://www.hertz.com/,"Estero, Fla, USA",26.438136,-81.80675229999997,White,"Sep 16, 2019 09:25am","Sep 16, 2019 09:48am"
116,"454. Chemours, Wilmington, DE, USA","",http://www.chemours.com/,"Wilmington, DE, USA",39.74465499999999,-75.54839090000002,White,"Sep 16, 2019 09:25am","Sep 16, 2019 09:48am"
117,"453. Northern Trust, Chicago, IL, USA","",https://www.northerntrust.com/united-states/home,"Northern Trust, South LaSalle Street, Chicago, IL, USA",41.8815778,-87.63258109999998,White,"Sep 16, 2019 09:25am","Sep 26, 2023 11:20pm"
118,330. Calpine,"",http://www.calpine.com/,"Houston, Texas, USA",29.7604267,-95.3698028,White,"Sep 16, 2019 09:25am","Sep 16, 2019 09:48am"
119,"452. Rockwell Automation, Inc., Milwaukee, WI, USA","",http://www.rockwellautomation.com/,"Rockwell Automation, Inc., South 2nd Street, Milwaukee, WI, USA",43.0185625,-87.91337060000001,White,"Sep 16, 2019 09:25am","Sep 16, 2019 09:48am"
120,"329. O'Reilly Auto Parts Distribution Center, West Broadway Avenue, Minneapolis, MN, USA","",http://www.oreillyauto.com/,"O'Reilly Auto Parts Distribution Center, West Broadway Avenue, Minneapolis, MN, USA",45.0748278,-93.37373960000002,White,"Sep 16, 2019 09:25am","Sep 16, 2019 09:48am"
121,"45. Burlington Stores, Burlington, NJ, USA","",http://www.burlingtoninvestors.com/,"Burlington, NJ, USA",40.071222,-74.86488729999996,White,"Sep 16, 2019 09:25am","Sep 16, 2019 09:48am"
122,328. Hormel Foods,"Austin, Minn, USA
",http://www.hormelfoods.com/,"Austin, Minn, USA",43.6666296,-92.97463670000002,White,"Sep 16, 2019 09:25am","Sep 16, 2019 09:48am"
