"","ref_number","prefix","property_name","state","county","city","street_number","status","request_type","restricted_address","acreage_of_property","area_of_significance","category_of_property","external_link","level_of_significance_international","level_of_significance_national","level_of_significance_state","level_of_significance_local","level_of_significance_not_indicated","listed_date","nhl_designated_date","other_names","park_name","property_id","district_name","address","latitude","longitude"
"54","100002358","SG","Ok Ranch Historic District","Arizona","Yavapai","Sedona","Red Rock Crossing, Sedona Ranger District, Coconino National Forest","Listed","Single",FALSE,45.19,"Agriculture; Architecture; Engineering","District",NA,FALSE,FALSE,FALSE,TRUE,FALSE,2018-04-19,NA,"Palo Bonjto; Crescent Moon Ranch; CNF Site AR03040600408",NA,"100002358","Ok Ranch","Ok Ranch Historic District, Yavapai, Arizona",34.475062919532,-112.875647813789
"55","89001074",NA,"Pine Crest Historic District","Arizona","Yavapai","Prescott","Roughly bounded by San Carlos St., Coronado Ave., and Yavapai, Apache, and Mohave Drs.","Listed","Single",FALSE,12,"Community Planning And Development; Health/Medicine; Architecture","District","https://catalog.archives.gov/id/75610686",FALSE,FALSE,FALSE,TRUE,FALSE,1989-08-10,NA,NA,NA,"89001074","Pine Crest","Pine Crest Historic District, Yavapai, Arizona",34.725643487054,-111.960960026812
"56","94000829",NA,"Prescott Armory Historic District","Arizona","Yavapai","Prescott","Roughly bounded by E. Gurley, E. Willis, N. Arizona, E. Sheldon and N. Rush Sts.","Listed","Single",FALSE,12,"Military; Entertainment/Recreation; Conservation; Community Planning And Development; Social History; Politics/Government; Architecture","District","https://catalog.archives.gov/id/75610702",FALSE,FALSE,FALSE,TRUE,FALSE,1994-08-15,NA,"Citizens Cemetery;Smoki Pueblo &amp; Public Museum;Prescott Nati",NA,"94000829","Prescott Armory","Prescott Armory Historic District, Yavapai, Arizona",32.21424,-110.97181
"57","04000511",NA,"Seligman Commercial Historic District","Arizona","Yavapai","Seligman","Roughly bounded by First and Lamport Sts, and Picacho and Railroad Aves.","Listed","Single",FALSE,18,"Commerce; Transportation; Architecture","District","https://catalog.archives.gov/id/75610718",FALSE,FALSE,FALSE,TRUE,FALSE,2005-02-01,NA,NA,NA,"04000511","Seligman Commercial","Seligman Commercial Historic District, Yavapai, Arizona",35.327465,-112.879215
"58","100011217","MP","Tuzigoot Developed Area Historic District","Arizona","Yavapai","Clarkdale","25 West Tuzigoot Road, Tuzigoot National Monument (TUZI)","Listed","Multiple",FALSE,55.24,"Conservation; Entertainment/Recreation; Community Planning And Development; Landscape Architecture; Architecture","District",NA,FALSE,FALSE,TRUE,TRUE,FALSE,2025-01-06,NA,NA,NA,"100011217","Tuzigoot Developed Area","Tuzigoot Developed Area Historic District, Yavapai, Arizona",34.59988,-112.55387
"59","89001075",NA,"West Prescott Historic District","Arizona","Yavapai","Prescott","Roughly bounded by Gurley Dr., Park Ave., Country Club Dr., Vista Dr., and Coronado Ave.","Listed","Single",FALSE,12,"Community Planning And Development; Architecture","District","https://catalog.archives.gov/id/75609321",FALSE,FALSE,FALSE,TRUE,FALSE,1989-08-10,NA,"See Also:Hill,Amy,House",NA,"89001075","West Prescott","West Prescott Historic District, Yavapai, Arizona",34.764656290259,-112.440047759196
"60","97001087",NA,"West Prescott Historic District (Boundary Increase)","Arizona","Yavapai","Prescott","619-621 Glendale Ave.","Listed","Multiple",FALSE,0,NA,"District","https://catalog.archives.gov/id/75609275",FALSE,FALSE,FALSE,FALSE,FALSE,2004-01-24,NA,"See also:West Prescott Historic District",NA,"97001087","West Prescott (Boundary Increase)","West Prescott Historic District (Boundary Increase), Yavapai, Arizona",34.764656290259,-112.440047759196
"61","00001388",NA,"Whipple Heights Historic District","Arizona","Yavapai","Prescott","E. Gurley, N. Virginia and Washington, E. Moeller Sts.","Listed","Single",FALSE,28.7,"Community Planning And Development; Architecture","District","https://catalog.archives.gov/id/75610726",FALSE,FALSE,FALSE,TRUE,FALSE,2000-12-07,NA,NA,NA,"00001388","Whipple Heights","Whipple Heights Historic District, Yavapai, Arizona",34.55669,-112.44961
"62","82001625",NA,"Brinley Avenue Historic District","Arizona","Yuma","Yuma","29-96 W. 2nd St., 198-200 S. Main, 201 S. 1st, and 102-298 Madison Aves.","Listed","Multiple",FALSE,8.4,"Exploration/Settlement; Architecture","District","https://catalog.archives.gov/id/75609473",FALSE,TRUE,FALSE,FALSE,FALSE,1982-12-07,NA,NA,NA,"82001625","Brinley Avenue","Brinley Avenue Historic District, Yuma, Arizona",32.640646746024,-114.753086812825
"63","88001834",NA,"Yuma Century Heights Conservancy Residential Historic District","Arizona","Yuma","Yuma","Roughly bounded by 4th Ave., 8th St., 1st and Orange Aves.","Listed","Single",FALSE,46,"Exploration/Settlement; Architecture","District","https://catalog.archives.gov/id/75610775",FALSE,FALSE,FALSE,TRUE,FALSE,1988-10-11,NA,"See Also:82001627;82001628;82001632;82004844;82001638;820016",NA,"88001834","Yuma Century Heights Conservancy Residential","Yuma Century Heights Conservancy Residential Historic District, Yuma, Arizona",32.722313,-114.62088
"64","94000068",NA,"Yuma Main Street Historic District","Arizona","Yuma","Yuma","170--387 S. Main St., 10--29 W. Third St.","Listed","Single",FALSE,12,"Commerce","District","https://catalog.archives.gov/id/75610771",FALSE,FALSE,FALSE,TRUE,FALSE,1994-03-10,NA,"See also:Yuma Post Office;Lee Hotel;Sanguinetti General Merc",NA,"94000068","Yuma Main Street","Yuma Main Street Historic District, Yuma, Arizona",32.722313,-114.62088
"65","10000213",NA,"Dewitt Commercial Historic District","Arkansas","Arkansas","Dewitt","Roughly bounded by N. Washington, 2nd St., S. Adams and Gibson Ave.","Listed","Single",FALSE,13.2,"Architecture; Community Planning And Development; Commerce","District",NA,FALSE,FALSE,FALSE,TRUE,FALSE,2010-04-27,NA,NA,NA,"10000213","Dewitt Commercial","Dewitt Commercial Historic District, Arkansas, Arkansas",34.2954174,-91.3344488
"66","07000502",NA,"Stuttgart Commercial Historic District","Arkansas","Arkansas","Stuttgart","Roughly bounded by 1st St., College St., 6th St., and Maple St.","Listed","Single",FALSE,25,"Architecture; Commerce; Politics/Government; Social History","District",NA,FALSE,FALSE,FALSE,TRUE,FALSE,2007-06-04,NA,NA,NA,"07000502","Stuttgart Commercial","Stuttgart Commercial Historic District, Arkansas, Arkansas",34.2954174,-91.3344488
"67","08001333",NA,"Hamburg Commercial Historic District","Arkansas","Ashley","Hamburg","100-200 block of E. Adams; 100 block N. Mulberry; 201 S. Mulberry; 201 and 205 N. Main St.","Listed","Single",FALSE,7.3,"Architecture; Commerce; Community Planning And Development","District",NA,FALSE,FALSE,FALSE,TRUE,FALSE,2009-03-23,NA,NA,NA,"08001333","Hamburg Commercial","Hamburg Commercial Historic District, Ashley, Arkansas",33.2278219,-91.7974997
"68","06001311",NA,"Horace Mann School Historic District","Arkansas","Baxter","Norfolk","City Hall Circle","Listed","Multiple",FALSE,2,"Architecture; Education; Social History","District",NA,FALSE,FALSE,FALSE,TRUE,FALSE,2007-01-29,NA,"Norfork Public School; B 0051; BA0144; B 0145; B0146",NA,"06001311","Horace Mann School","Horace Mann School Historic District, Baxter, Arkansas",33.52821,-91.498138
"69","10000348",NA,"Mountain Home Commercial Historic District","Arkansas","Baxter","Mountain Home","Roughly bounded on the N by E 5th St, E 9th St on the S, S St on the E, and Hickory St on the W","Listed","Single",FALSE,16.4,"Commerce; Architecture","District",NA,FALSE,FALSE,FALSE,TRUE,FALSE,2010-06-15,NA,"BA0155",NA,"10000348","Mountain Home Commercial","Mountain Home Commercial Historic District, Baxter, Arkansas",36.335882,-92.387497
"70","93001202",NA,"Bentonville Third Street Historic District","Arkansas","Benton","Bentonville","Roughly, 3rd St. SE. from Main St. to C St. SE.","Listed","Multiple",FALSE,10,"Architecture","District",NA,FALSE,FALSE,FALSE,TRUE,FALSE,1993-11-12,NA,"See Also:Elliott House;Rice, James A., House",NA,"93001202","Bentonville Third Street","Bentonville Third Street Historic District, Benton, Arkansas",36.376239908083,-91.823458496679
"71","92001349",NA,"Bentonville West Central Avenue Historic District","Arkansas","Benton","Bentonville","W. Central Ave. between SW. A and SW. G Sts.","Listed","Multiple",FALSE,16,"Architecture","District",NA,FALSE,FALSE,FALSE,TRUE,FALSE,1992-10-22,NA,"See Also:Craig--Bryan House;Jackson House;Linebarger House",NA,"92001349","Bentonville West Central Avenue","Bentonville West Central Avenue Historic District, Benton, Arkansas",36.366978766174,-94.113489891212
"72","97000791",NA,"Carl's Addition Historic District","Arkansas","Benton","Siloam Springs","Along S. College, W. Alpine, and S. Wright Sts., Bounded by Sager Cr. and W. Twin Springs Ave.","Listed","Multiple",FALSE,15,"Architecture","District",NA,FALSE,FALSE,FALSE,TRUE,FALSE,1997-07-17,NA,NA,NA,"97000791","Carl's Addition","Carl's Addition Historic District, Benton, Arkansas",34.569286,-92.585398
"73","87002425","AD","Gypsy Camp Historic District","Arkansas","Benton","Siloam Springs","Off AR 59","Listed","Add.doc.",FALSE,11.5,"Entertainment/Recreation; Architecture","Building",NA,FALSE,FALSE,TRUE,TRUE,FALSE,1988-01-28,NA,NA,NA,"87002425","Gypsy Camp","Gypsy Camp Historic District, Benton, Arkansas",34.87,-92.8208333
"74","07000445",NA,"Pea Ridge Commercial Historic District","Arkansas","Benton","Pea Ridge","Pickens St. roughly be. Greene St. and Davis St. and Curtis Ave. roughly bet. Pike St. and Macintosh St.","Listed","Multiple",FALSE,6,"Commerce; Architecture","District",NA,FALSE,FALSE,FALSE,TRUE,FALSE,2007-05-22,NA,"BE 3155; BE3152; BE3153; BE1354; BE1353; BE1352; BE3166; BE3167; BE1355; BE1356; BE3168; BE3162; BE3160; BE3159",NA,"07000445","Pea Ridge Commercial","Pea Ridge Commercial Historic District, Benton, Arkansas",36.3329882,-94.1167586
"75","98001482",NA,"Rogers Commercial Historic District (Boundary Increase Ii)","Arkansas","Benton","Rogers","120 S. Second St.","Listed","Multiple",FALSE,0.9,"Architecture","Building",NA,FALSE,FALSE,FALSE,TRUE,FALSE,1998-12-09,NA,"BEI733;Edwards Grocery;Watson's Goodyear Store",NA,"98001482","Rogers Commercial (Boundary Increase Ii)","Rogers Commercial Historic District (Boundary Increase Ii), Benton, Arkansas",36.3329882,-94.1167586
"76","12000855",NA,"Rogers Commercial Historic District (Boundary Increase Iii)","Arkansas","Benton","Rogers","300 blk. S. 1st, 100 blk. S. 2nd, 200 blk. W. Walnut, & 200 blk. W. Elm Sts.","Listed","Multiple",FALSE,0.9,"Architecture","District",NA,FALSE,FALSE,FALSE,TRUE,FALSE,2012-10-17,NA,NA,NA,"12000855","Rogers Commercial (Boundary Increase Iii)","Rogers Commercial Historic District (Boundary Increase Iii), Benton, Arkansas",36.3329882,-94.1167586
"77","02001079",NA,"Rogers Commercial Historic District (Boundary Increase)","Arkansas","Benton","Rogers","116 S, Second St.","Listed","Multiple",FALSE,0.9,"Architecture","Building",NA,FALSE,FALSE,FALSE,TRUE,FALSE,2002-10-04,NA,"Victory Theater",NA,"02001079","Rogers Commercial (Boundary Increase)","Rogers Commercial Historic District (Boundary Increase), Benton, Arkansas",36.3329882,-94.1167586
"78","93001028",NA,"Rogers Commercial Historic District (Boundary Increase)","Arkansas","Benton","Rogers","Roughly bounded by Walnut, First, Poplar and Second Sts.","Listed","Multiple",FALSE,7,"Architecture","District",NA,FALSE,FALSE,FALSE,TRUE,FALSE,1993-09-30,NA,"Walnut Street Historic District (Boundary Increase);See Also",NA,"93001028","Rogers Commercial (Boundary Increase)","Rogers Commercial Historic District (Boundary Increase), Benton, Arkansas",36.3329882,-94.1167586
"79","94001338","AD","Siloam Springs Downtown Historic District (Additional Documentation)","Arkansas","Benton","Siloam Springs","Roughly bounded by Sager Cr., Ashley St., Madison Ave. and Twin Springs St.","Listed","Add.doc.",FALSE,40,"Architecture","District",NA,FALSE,FALSE,FALSE,TRUE,FALSE,1995-05-26,NA,"See Also:79000432;87002386;87002428;87002431;87002432;870023",NA,"94001338","Siloam Springs Downtown (Additional Documentation)","Siloam Springs Downtown Historic District (Additional Documentation), Benton, Arkansas",34.569286,-92.585398
"80","01000113",NA,"Sulphur Springs Old School Complex Historic District","Arkansas","Benton","Sulphur Springs","512 Black St.","Listed","Single",FALSE,3,"Architecture; Education","District",NA,FALSE,FALSE,FALSE,TRUE,FALSE,2001-02-16,NA,"BE3573",NA,"01000113","Sulphur Springs Old School Complex","Sulphur Springs Old School Complex Historic District, Benton, Arkansas",35.32675,-92.22848
"81","87002412","AD","Walnut Street Historic District","Arkansas","Benton","Rogers","Walnut St.","Listed","Add.doc.",FALSE,5.5,"Architecture","District",NA,FALSE,FALSE,TRUE,TRUE,FALSE,1988-01-28,NA,"See Also:Rogers Commercial Historic District (Boundary Incre",NA,"87002412","Walnut Street","Walnut Street Historic District, Benton, Arkansas",36.3329882,-94.1167586
"82","07000954",NA,"Cricket And Crest Tunnels Historic District","Arkansas","Boone","Omaha","Under and W of Old US 65","Listed","Single",FALSE,25.5,"Transportation; Engineering","District",NA,FALSE,FALSE,FALSE,TRUE,FALSE,2007-09-19,NA,"Sites # BO0197-BO0198; Omaha and Turkey Creek Tunnels; Tunnels ""B"" &amp; ""C""",NA,"07000954","Cricket And Crest Tunnels","Cricket And Crest Tunnels Historic District, Boone, Arkansas",36.483399,-93.205458
"83","99000523",NA,"Harrison Courthouse Square Historic District","Arkansas","Boone","Harrison","Roughly bounded by N. Walnut, W. Ridge, N. Willow, and W. Stephenson Sts.","Listed","Single",FALSE,15.5,"Community Planning And Development; Architecture; Commerce; Politics/Government","District",NA,FALSE,FALSE,FALSE,TRUE,FALSE,1999-05-06,NA,"BO 0091",NA,"99000523","Harrison Courthouse Square","Harrison Courthouse Square Historic District, Boone, Arkansas",36.229803,-93.107432
"84","16000433",NA,"Warren Commercial Historic District","Arkansas","Bradley","Warren","Roughly bounded by Alabama, Elm, Chestnut, 2nd, Church, Main & Howard Sts.","Listed","Single",FALSE,20,"Commerce; Politics/Government","District",NA,FALSE,FALSE,FALSE,TRUE,FALSE,2016-07-11,NA,"BR0138",NA,"16000433","Warren Commercial","Warren Commercial Historic District, Bradley, Arkansas",33.615051,-92.064277
"85","16000402",NA,"Berryville Commercial Historic District","Arkansas","Carroll","Berryville","Public Square","Listed","Single",FALSE,24,"Commerce; Politics/Government; Architecture","District",NA,FALSE,FALSE,FALSE,TRUE,FALSE,2016-06-23,NA,NA,NA,"16000402","Berryville Commercial","Berryville Commercial Historic District, Carroll, Arkansas",36.3649629,-93.5675582
"86","70000118",NA,"Eureka Springs Historic District","Arkansas","Carroll","Eureka Springs","Most Eureka Springs and its environs","Listed","Single",FALSE,1246,"Commerce; Architecture; Community Planning And Development; Landscape Architecture; Health/Medicine; Social History","District",NA,FALSE,TRUE,FALSE,TRUE,FALSE,1970-12-18,NA,"See Also:Eureka Springs Historic District (Boundary Increase",NA,"70000118","Eureka Springs","Eureka Springs Historic District, Carroll, Arkansas",36.40285,-93.73658
"87","79003730",NA,"Eureka Springs Historic District (Boundary Increase)","Arkansas","Carroll","Eureka Springs","S. Main","Listed","Single",FALSE,5,"Commerce; Architecture; Social History","District",NA,FALSE,FALSE,FALSE,TRUE,FALSE,1979-01-29,NA,"Eureka Springs Railroad Depot;See Also:Eureka Springs Histor",NA,"79003730","Eureka Springs (Boundary Increase)","Eureka Springs Historic District (Boundary Increase), Carroll, Arkansas",36.40285,-93.73658
"88","98001346",NA,"Lake Leatherwood Park Historic District","Arkansas","Carroll","Eureka Springs","Bet. US 62 and AR 23 at Leatherwood L.","Listed","Multiple",FALSE,1600,"Exploration/Settlement; Social History; Architecture","District",NA,FALSE,FALSE,FALSE,TRUE,FALSE,1998-11-24,NA,"CR2017-CR2038;See Also: Lake Leatherwood Recreational Facili",NA,"98001346","Lake Leatherwood Park","Lake Leatherwood Park Historic District, Carroll, Arkansas",36.479482526829,-93.758772177206
"89","98001346","RS","Lake Leatherwood Park Historic District (Additional Documentation)","Arkansas","Carroll","Eureka Springs","1303 Cty. Rd. 204","Listed","Resubmission",FALSE,1566,"Entertainment/Recreation","District",NA,FALSE,FALSE,FALSE,TRUE,FALSE,1998-11-24,NA,NA,NA,"98001346","Lake Leatherwood Park (Additional Documentation)","Lake Leatherwood Park Historic District (Additional Documentation), Carroll, Arkansas",36.34102,-93.53818
"90","09001238",NA,"Sanitarium Lake Bridges Historic District","Arkansas","Carroll","Eureka Springs","Carroll Co. Rd. 317, approx. .5 mi. S. of Greenwood Hollow Rd.","Listed","Multiple",FALSE,0.9,"Engineering; Transportation","District",NA,FALSE,FALSE,FALSE,TRUE,FALSE,2010-01-19,NA,"Bridges #10955 &amp; #10956; Marble Bridge &amp; Lake St. Bridge; Site #CR2110 &amp; CR2112",NA,"09001238","Sanitarium Lake Bridges","Sanitarium Lake Bridges Historic District, Carroll, Arkansas",36.34102,-93.53818
"91","10000789",NA,"Dermott Commercial Historic District","Arkansas","Chicot","Dermott","101-120 N. Freeman; 101-219 E. Iowa St. and 131 N. Main St.","Listed","Single",FALSE,4.2,"Commerce","District",NA,FALSE,FALSE,FALSE,TRUE,FALSE,2010-09-23,NA,"CH0019-CH0021; CH0024; CH0025; CH0030; CH0190-CH0213",NA,"10000789","Dermott Commercial","Dermott Commercial Historic District, Chicot, Arkansas",33.524937,-91.433234
"92","11000025",NA,"Lake Village Commercial Historic District","Arkansas","Chicot","Lake Village","Roughly bounded by Lakeshore Dr, Jackson St, Chicot St, and Church St","Listed","Single",FALSE,5.9,"Architecture; Commerce","District",NA,FALSE,FALSE,FALSE,TRUE,FALSE,2011-02-18,NA,NA,NA,"11000025","Lake Village Commercial","Lake Village Commercial Historic District, Chicot, Arkansas",33.3309708,-91.2817058
"93","11000464",NA,"Arkadelphia Commercial Historic District","Arkansas","Clark","Arkadelphia","Roughly Main St. between 5th & 7th Sts., & Clinton St between 6th & 9th Sts.","Listed","Single",FALSE,7,"Commerce","District",NA,FALSE,FALSE,FALSE,TRUE,FALSE,2011-07-20,NA,NA,NA,"11000464","Arkadelphia Commercial","Arkadelphia Commercial Historic District, Clark, Arkansas",34.120959,-93.053523
"94","100008977","RS","Henderson State University Historic District","Arkansas","Clark","Arkadelphia","1100 Henderson St.","Listed","Resubmission",FALSE,30,"Education","District",NA,FALSE,FALSE,FALSE,TRUE,FALSE,2023-08-08,NA,NA,NA,"100008977","Henderson State University","Henderson State University Historic District, Clark, Arkansas",34.1259012,-93.0598946
"95","09000867",NA,"Piggott Commercial Historic District","Arkansas","Clay","Piggott","Roughly bounded on the N. by W. Cherry on the South by W. Court, on the E. by S. Throgmorton and the W. by Clay","Listed","Single",FALSE,20,"Architecture; Community Planning And Development; Commerce","District",NA,FALSE,FALSE,FALSE,TRUE,FALSE,2009-11-04,NA,"Site #CY0211",NA,"09000867","Piggott Commercial","Piggott Commercial Historic District, Clay, Arkansas",34.2954174,-91.3344488
"96","09000369","AD","Rector Commercial Historic District","Arkansas","Clay","Rector","Bounded by St. Louis and Southwestern Railroad tracks on the E. and S., S. Dodd on the W., 3rd St. on the N.","Listed","Add.doc.",FALSE,11.4,"Community Planning And Development; Commerce; Architecture","District",NA,FALSE,FALSE,FALSE,TRUE,FALSE,2009-06-01,NA,NA,NA,"09000369","Rector Commercial","Rector Commercial Historic District, Clay, Arkansas",34.2954174,-91.3344488
"97","09000266",NA,"Heber Springs Commercial Historic District","Arkansas","Cleburne","Heber Springs","100, 200 blocks E. Main St., 100-500 blocks of W. Main St., 100 block of N. and S. 3rd and N. and S. 4th Sts.","Listed","Single",FALSE,31.5,"Architecture; Commerce; Community Planning And Development; Entertainment/Recreation","District",NA,FALSE,FALSE,FALSE,TRUE,FALSE,2009-05-01,NA,NA,NA,"09000266","Heber Springs Commercial","Heber Springs Commercial Historic District, Cleburne, Arkansas",35.491487,-92.030201
"98","01001118",NA,"New Edinburg Commercial Historic District","Arkansas","Cleveland","New Edinburg","AR 8","Listed","Single",FALSE,5.3,"Architecture; Exploration/Settlement","District",NA,FALSE,FALSE,FALSE,TRUE,FALSE,2001-10-22,NA,NA,NA,"01001118","New Edinburg Commercial","New Edinburg Commercial Historic District, Cleveland, Arkansas",33.757468,-92.238609
"99","09001240",NA,"Cross And Nelson Hall Historic District","Arkansas","Columbia","Magnolia","Southern Arkansas University Campus at 100 E. University","Listed","Multiple",FALSE,3,"Education; Social History","District",NA,FALSE,FALSE,FALSE,TRUE,FALSE,2010-01-20,NA,"Boy's Dormitory and Girl's Dormatory; Site #CO0427-CO0428; Student Services Building",NA,"09001240","Cross And Nelson Hall","Cross And Nelson Hall Historic District, Columbia, Arkansas",36.32662798107,-92.388603981765
"100","12001231",NA,"Dolph Camp, Bussey And Peace Halls Historic District","Arkansas","Columbia","Magnolia","E. side of Lane Dr., Southern Arkansas University","Listed","Single",FALSE,3.5,"Architecture","District",NA,FALSE,FALSE,FALSE,TRUE,FALSE,2013-01-29,NA,"Site # CO0506-CO0508",NA,"12001231","Dolph Camp, Bussey And Peace Halls","Dolph Camp, Bussey And Peace Halls Historic District, Columbia, Arkansas",33.155365,-93.449554
